<?xml version="1.0"?>
<?xml-stylesheet type="text/xsl" href="../../style/slides.xsl"?>

<sprintreview folder="140328" xmlns:xsi="http://www.w3.org/2001/XMLSchema-instance" xsi:noNamespaceSchemaLocation="../../style/sprint-review.xsd">
    <team name="team-ba">
        <member type="scrummaster" capacity="0">Alexander </member>
        <member type="hands-on" capacity="4.25">Jan </member>
        <member type="hands-on" capacity="4.25">Saskia </member>
        <member type="hands-on" capacity="4.25">Michiel </member>
        <member type="hands-on" capacity="4.25">Jetro </member>
    </team>

    <stories> <!-- state can be: "story done" | "story not-done" | "story uncommitted" | "bug"  -->
        <story state="story done" points="1.25" title="ABO: Identificatie en planning increments ABO"><slides><slide type="story-narrative"></slide></slides></story>
        <story state="story done" points="0.5" title="Bijwerken SAM management (mail Gert  11/3)"><slides><slide type="story-narrative"></slide></slides></story>
        <story state="story done" points="0.25" title="Review ABO-20 en ABO-21 TO DL afsluiting"><slides><slide type="story-narrative"></slide></slides></story>
        <story state="story done" points="1" title="KB:UCM, beheer adressen, bewerk persoon UC "><slides><slide type="story-narrative"></slide></slides></story>
        <story state="story not-done" percentage-done="75" points="4" title="VVK: Verwerking review comments VVK verkoop (UCM/UCSS/LIM/SNM)"><slides><slide type="story-narrative"></slide></slides></story>
        <story state="story not-done" percentage-done="99" points="0.75" title="Matrix 5 KB: Commerciële historiek tonen (events, acties en UI definiëren: cfr. SAM, Card mgmt)"><slides><slide type="story-narrative"></slide></slides></story>
        <story state="story done" points="0.25" title="Matrix 6 KB: aanmaken klant e-ID, Mobib-kaart andere OV"><slides><slide type="story-narrative"></slide></slides></story>
        <story state="story done" points="0.5" title="Aanpassingsvoorstel ABO-08 TO Terugbetalingen (input voor Wouter)"><slides><slide type="story-narrative"></slide></slides></story>
        <story state="story done" points="3" title="PO"><slides><slide type="story-narrative"></slide></slides></story>
        <story state="story not-done" percentage-done="99" points="1" title="WBS DBS"><slides><slide type="story-narrative"></slide></slides></story>
        <story state="story not-done" percentage-done="99" points="2.5" title="DBS Matrix 1 - Lijnwinkel FO"><slides><slide type="story-narrative"></slide></slides></story>
        <story state="story done" points="0.75" title="Voorbereiding presentatie Kickoff 21/3"><slides><slide type="story-narrative"></slide></slides></story>
        <story state="story not-done" percentage-done="0" points="0.25" title="KB VVK: scan review DL op LIM/SNM/UCM/UCSS"><slides><slide type="story-narrative"></slide></slides></story>
        <story state="story done" points="1.5" title="kick-off 21/03 De Lijn Business"><slides><slide type="story-narrative"></slide></slides></story>
   </stories>        

</sprintreview>
