<?xml version="1.0"?>
<?xml-stylesheet type="text/xsl" href="../style/slides.xsl"?>

<sprintreview folder="140228" xmlns:xsi="http://www.w3.org/2001/XMLSchema-instance" xsi:noNamespaceSchemaLocation="../style/sprint-review.xsd">
    <team name="TechTeam">
        <member type="scrummaster" capacity="0">Michael D. </member>
        <member type="hands-on" capacity="4">Michael B. </member>
        <member type="hands-on" capacity="4">Philip </member>
        <member type="hands-on" capacity="4">Steven W. </member>
        <member type="hands-on" capacity="4">Steven R. </member>
        <member type="tester" capacity="4">Niels </member>
        <member type="tester" capacity="4">Dorien </member>
    </team>

    <stories> <!-- state can be: "story done" | "story not-done" | "story uncommitted" | "bug"  -->
        <story title="" state="story done" points="0"><slides><slide type="story-narrative"></slide></slides></story>
        <story title="" state="story done" points="0"><slides><slide type="story-narrative"></slide></slides></story>
        <story title="" state="story done" points="0"><slides><slide type="story-narrative"></slide></slides></story>
        <story title="" state="story done" points="0"><slides><slide type="story-narrative"></slide></slides></story>
        <story title="" state="story done" points="0"><slides><slide type="story-narrative"></slide></slides></story>
        <story title="" state="story done" points="0"><slides><slide type="story-narrative"></slide></slides></story>
        <story title="" state="story done" points="0"><slides><slide type="story-narrative"></slide></slides></story>
        <story title="" state="story done" points="0"><slides><slide type="story-narrative"></slide></slides></story>
        <story title="" state="story done" points="0"><slides><slide type="story-narrative"></slide></slides></story>
        <story title="" state="story done" points="0"><slides><slide type="story-narrative"></slide></slides></story>
        <story title="" state="story done" points="0"><slides><slide type="story-narrative"></slide></slides></story>
        <story title="" state="story done" points="0"><slides><slide type="story-narrative"></slide></slides></story>
        <story title="" state="story done" points="0"><slides><slide type="story-narrative"></slide></slides></story>
        <story title="" state="story done" points="0"><slides><slide type="story-narrative"></slide></slides></story>
        <story title="" state="story done" points="0"><slides><slide type="story-narrative"></slide></slides></story>
        <story title="" state="story done" points="0"><slides><slide type="story-narrative"></slide></slides></story>
        <story title="" state="story done" points="0"><slides><slide type="story-narrative"></slide></slides></story>
        <story title="" state="story done" points="0"><slides><slide type="story-narrative"></slide></slides></story>
        <story title="" state="story done" points="0"><slides><slide type="story-narrative"></slide></slides></story>
        <story title="" state="story done" points="0"><slides><slide type="story-narrative"></slide></slides></story>
        <story title="" state="story done" points="0"><slides><slide type="story-narrative"></slide></slides></story>
        <story title="" state="story done" points="0"><slides><slide type="story-narrative"></slide></slides></story>
        <story title="" state="story done" points="0"><slides><slide type="story-narrative"></slide></slides></story>
        <story title="" state="story done" points="0"><slides><slide type="story-narrative"></slide></slides></story>
   </stories>        

</sprintreview>
