<?xml version="1.0"?>
<?xml-stylesheet type="text/xsl" href="../../style/slides.xsl"?>

<sprintreview folder="140404" xmlns:xsi="http://www.w3.org/2001/XMLSchema-instance" xsi:noNamespaceSchemaLocation="../../style/sprint-review.xsd">
    <team name="team-ba">
        <member type="scrummaster" capacity="0">Alexander </member>
        <member type="hands-on" capacity="4">Jan </member>
        <member type="hands-on" capacity="3.5">Saskia </member>
        <member type="hands-on" capacity="4">Michiel </member>
        <member type="hands-on" capacity="4">Jetro </member>
    </team>

    <stories> <!-- state can be: "story done" | "story not-done" | "story uncommitted" | "bug"  -->
        <story state="story done" points="1" title="KB: privacy routines (verwijderen persoonsgegevens)"><slides><slide type="story-narrative"></slide></slides></story>
        <story state="story not-done" percentage-done="30" points="1.25" title="Matrix 5 Verkoop: Nazorg "><slides><slide type="story-narrative"></slide></slides></story>
        <story state="story done" points="0.5" title="Update MOBIB kaartbeheer: update LIM/SNM (Timeboxed)"><slides><slide type="story-narrative"></slide></slides></story>
        <story state="story done" points="0.25" title="Review SS AVU-31 Rechthebbenden VVK"><slides><slide type="story-narrative"></slide></slides></story>
        <story state="story done" points="3" title="VVK: Verwerking review comments VVK verkoop (UCM/UCSS/LIM/SNM)"><slides><slide type="story-narrative"></slide></slides></story>
        <story state="story done" points="1.25" title="PO"><slides><slide type="story-narrative"></slide></slides></story>
        <story state="story not-done" percentage-done="70" points="1.25" title="Verwerking feedback kickoff 21/3"><slides><slide type="story-narrative"></slide></slides></story>
        <story state="story done" points="1" title="Update WBS"><slides><slide type="story-narrative"></slide></slides></story>
        <story state="story not-done" percentage-done="0" points="1" title="KB: alternatieve scenario's (RR onbeschikbaar; detectie dubbels van klanten; eID lezer onbeschikbaar; veranderd INSZ nummer...)"><slides><slide type="story-narrative"></slide></slides></story>
        <story state="story not-done" percentage-done="25" points="1.25" title="IKB: terugbetalingen te veel betaald"><slides><slide type="story-narrative"></slide></slides></story>
        <story state="story done" points="0.5" title="DBS: meeting rond impact DBS op KB, Verkoop, inkomstenbeheer (Timeboxed!)"><slides><slide type="story-narrative"></slide></slides></story>
        <story state="story done" points="3.75" title="DBS: core DBS analyse (LIM, UCM, SNM, UCSS)"><slides><slide type="story-narrative"></slide></slides></story>
   </stories>       

</sprintreview>
