<?xml version="1.0"?>
<?xml-stylesheet type="text/xsl" href="../style/slides.xsl"?>

<sprintreview folder="140331" xmlns:xsi="http://www.w3.org/2001/XMLSchema-instance" xsi:noNamespaceSchemaLocation="../style/sprint-review.xsd">
    <team name="Team CCBO">
        <member type="scrummaster" capacity="5">Fares Stita </member>
        <member type="hands-on" capacity="10">Gerrit Hernou </member>
        <member type="hands-on" capacity="10">Koenraad De Bisschop </member>
        <member type="tester" capacity="10">Johan Santamaria </member>
    </team>

    <stories> <!-- state can be: "story done" | "story not-done" | "story uncommitted" | "bug"  -->
        <story title="" state="story done" points="0"><slides><slide type="story-narrative"></slide></slides></story>
        <story title="" state="story done" points="0"><slides><slide type="story-narrative"></slide></slides></story>
        <story title="" state="story done" points="0"><slides><slide type="story-narrative"></slide></slides></story>
        <story title="" state="story done" points="0"><slides><slide type="story-narrative"></slide></slides></story>
        <story title="" state="story done" points="0"><slides><slide type="story-narrative"></slide></slides></story>
        <story title="" state="story done" points="0"><slides><slide type="story-narrative"></slide></slides></story>
        <story title="" state="story done" points="0"><slides><slide type="story-narrative"></slide></slides></story>
        <story title="" state="story done" points="0"><slides><slide type="story-narrative"></slide></slides></story>
        <story title="" state="story done" points="0"><slides><slide type="story-narrative"></slide></slides></story>
        <story title="" state="story done" points="0"><slides><slide type="story-narrative"></slide></slides></story>
        <story title="" state="story done" points="0"><slides><slide type="story-narrative"></slide></slides></story>
        <story title="" state="story done" points="0"><slides><slide type="story-narrative"></slide></slides></story>
        <story title="" state="story done" points="0"><slides><slide type="story-narrative"></slide></slides></story>
        <story title="" state="story done" points="0"><slides><slide type="story-narrative"></slide></slides></story>
        <story title="" state="story done" points="0"><slides><slide type="story-narrative"></slide></slides></story>
        <story title="" state="story done" points="0"><slides><slide type="story-narrative"></slide></slides></story>
        <story title="" state="story done" points="0"><slides><slide type="story-narrative"></slide></slides></story>
        <story title="" state="story done" points="0"><slides><slide type="story-narrative"></slide></slides></story>
        <story title="" state="story done" points="0"><slides><slide type="story-narrative"></slide></slides></story>
        <story title="" state="story done" points="0"><slides><slide type="story-narrative"></slide></slides></story>
        <story title="" state="story done" points="0"><slides><slide type="story-narrative"></slide></slides></story>
        <story title="" state="story done" points="0"><slides><slide type="story-narrative"></slide></slides></story>
        <story title="" state="story done" points="0"><slides><slide type="story-narrative"></slide></slides></story>
        <story title="" state="story done" points="0"><slides><slide type="story-narrative"></slide></slides></story>
   </stories>        

</sprintreview>
