<?xml version="1.0"?><?xml-stylesheet type="text/xsl" href="../../style/slides.xsl"?>
<sprintreview folder="141006" xmlns:xsi="http://www.w3.org/2001/XMLSchema-instance" xsi:noNamespaceSchemaLocation="../../style/sprint-review.xsd">
    <team name="BeSharp">
        <member type="productowner" capacity="0">Pieter Clavie </member>
        <member type="scrummaster" capacity="4">Denis Bollinne</member>
        <member type="hands-on" capacity="8">Marnix De Groote </member>
        <member type="hands-on" capacity="0">Martijn Evens </member>
        <member type="hands-on" capacity="8">Ignacio Errico </member>
        <member type="hands-on" capacity="8">Blaise Braye </member>
        <member type="tester" capacity="6">Parisa Pejham </member>
    </team>

  <intro>
    <slides>
      <slide title="current sprint" type="sprint-goal">
        <List xmlns="http://schemas.microsoft.com/sharepoint/">
          <b>Being able to estimate the Hastus import changes.</b>
        </List>
      </slide>  
    </slides>
  </intro>

  <metrics>
    <metric project="Transmodel.Netex" linesofcode="37992" stepfiles="75" unittests="517" complexity="9.847571189" />
    <metric project="JobOrchestration" linesofcode="3520" stepfiles="0" unittests="108" complexity="7.348148148" />
  </metrics>
  
    <stories>
		<story id="MOBITS-1593" relid="14524" points="2" state="story done" title="Enable stylecop for PoiTracker and fix"><slides><slide type="story-narrative"></slide></slides></story>
		<story id="MOBITS-1799" relid="14524" points="3" state="story done" title="As a planner I want the activation points inside the dataset"><slides><slide type="story-narrative"></slide></slides></story>
		<story id="MOBITS-2408" relid="14524" points="3" state="story done" title="As a planner I want a dataset on the board computer"><slides><slide type="story-narrative"></slide></slides></story>
		<story id="MOBITS-2466" relid="14524" points="1" state="story done" title="Review Manuals - Team Denis"><slides><slide type="story-narrative"></slide></slides></story>
		<story id="MOBITS-2341" relid="14524" points="5" state="story not-done" percentage-done="70"  title="As a client for the AVL service I want Train Messsages with context"><slides><slide type="story-narrative"></slide></slides></story>
		<story id="MOBITS-2362" relid="14524" points="3" state="story not-done" percentage-done="0"  title=" As a client for the AVL service I want Only Bus Messsages with context (technical implementation)"><slides><slide type="story-narrative"></slide></slides></story>
		<story id="MOBITS-2465" relid="14524" points="3" state="story not-done" percentage-done="0"  title="Writing usability cases part 2 - Team Denis"><slides><slide type="story-narrative"></slide></slides></story>
		<story id="MOBITS-2467" relid="14524" points="5" state="story not-done" percentage-done="50"  title="Import vehicle service &amp; block associations"><slides><slide type="story-narrative"></slide></slides></story>
		<story id="MOBITS-2468" relid="14524" points="3" state="story not-done" percentage-done="0"  title="Import block &amp; vehicle journey association"><slides><slide type="story-narrative"></slide></slides></story>
    	<story id="MOBITS-2514" relid="14524" points="0" state="story uncommitted" title="[DB Remodeling] Update DB and EDMX"><slides><slide type="story-narrative"></slide></slides></story>
   
    </stories>

</sprintreview>